id,label,left_id,left_publisher,left_isbn,left_title,left_series,left_author,left_year,left_ENTRYTYPE,left_journal,left_number,left_volume,left_link,left_pages,left_booktitle,left_crossref,right_id,right_title,right_booktitle,right_author,right_pages,right_year,right_organization,right_ENTRYTYPE,right_publisher,right_journal,right_number,right_volume
142,0,1942,0,0,"Spatial Data Analysis: Theory and Practice. By Robert Haining (Cambridge: Cambridge University Press, 2003) {ISBN} 0-521-77437-3",0,Roger Bivand,2004,article,International Journal of Geographical Information Science,3,18,http://dx.doi.org/10.1080/13658810310001638682,300--301,0,0,2085,Hierarchical topic models and the nested Chinese restaurant process,0,"Griffiths, DMBTL and Tenenbaum, MIJJB",17,2004,0,article,The MIT Press,Advances in neural information processing systems,0,16
143,0,2418,Prentice Hall,978-0-13-629874-8,Object-oriented databases,Prentice Hall International series in computer science,John G. Hughes,1991,book,0,0,0,0,0,0,0,676,Transaction Optimization in Rule Databases,0,"Guerrini, E Bertino B Catania G and Montesi, D",137--145,1994,0,article,0,Proc. Fourth IEEE Research Issues in Data Eng.: Active Database Systems (RIDE-ADS'94),0,
144,0,2272,0,0,On the Inference of Ancestries in Admixed Populations,0,Sriram Sankararaman and Gad Kimmel and Eran Halperin and Michael I. Jordan,2008,inproceedings,0,0,0,http://dx.doi.org/10.1007/978-3-540-78839-3_37,424--433,"Research in Computational Molecular Biology, 12th Annual International Conference, {RECOMB} 2008, Singapore, March 30 - April 2, 2008. Proceedings",DBLP:conf/recomb/2008,3091,ANViL: advanced virtualization for modern non-volatile memory devices,Proceedings of the 13th USENIX Conference on File and Storage Technologies,"Weiss, Zev and Subramanian, Sriram and Sundararaman, Swaminathan and Talagala, Nisha and Arpaci-Dusseau, Andrea C and Arpaci-Dusseau, Remzi H",111--118,2015,USENIX Association,inproceedings,0,0,0,
145,0,254,0,0,A false negative approach to mining frequent itemsets from high speed transactional data streams,0,Jeffrey Xu Yu and Zhihong Chong and Hongjun Lu and Zhenjie Zhang and Aoying Zhou,2006,article,Inf. Sci.,14,176,http://dx.doi.org/10.1016/j.ins.2005.11.003,1986--2015,0,0,2569,Personalized privacy protection in social networks,0,"Yuan, Mingxuan and Chen, Lei and Yu, Philip S",141--150,2010,0,article,VLDB Endowment,Proceedings of the VLDB Endowment,2,4
146,0,294,0,0,Indexing the Function: An Efficient Algorithm for Multi-dimensional Search with Expensive Distance Functions,0,Hanxiong Chen and Jianquan Liu and Kazutaka Furuse and Jeffrey Xu Yu and Nobuo Ohbo,2009,inproceedings,0,0,0,http://dx.doi.org/10.1007/978-3-642-03348-3_10,67--78,"Advanced Data Mining and Applications, 5th International Conference, {ADMA} 2009, Beijing, China, August 17-19, 2009. Proceedings",DBLP:conf/adma/2009,545,The SCIFC model for information flow control in web service composition,"Web Services, 2009. ICWS 2009. IEEE International Conference on","She, Wei and Yen, I and Thuraisingham, Bhavani and Bertino, Elisa and others",1--8,2009,IEEE,inproceedings,0,0,0,
147,0,1125,0,0,Integrated science for environmental decision-making: the challenge for biodiversity and ecosystem informatics,0,Gladys A. Cotter and Mike Frame and Ron Sepic,2004,article,Data Science Journal,0,3,http://dx.doi.org/10.2481/dsj.3.38,38--59,0,0,2185,Semi-supervised learning via Gaussian processes,Advances in neural information processing systems,"Lawrence, Neil D and Jordan, Michael I",753--760,2004,0,inproceedings,0,0,0,
148,1,133,0,0,Constructing Suffix Tree for Gigabyte Sequences with Megabyte Memory,0,Ching{-}Fung Cheung and Jeffrey Xu Yu and Hongjun Lu,2005,article,{IEEE} Trans. Knowl. Data Eng.,1,17,http://dx.doi.org/10.1109/TKDE.2005.3,90--105,0,0,1639,Constructing suffix tree for gigabyte sequences with megabyte memory,0,"Cheung, Ching-Fung and Yu, Jeffrey Xu and Lu, Hongjun",90--105,2005,0,article,IEEE,"Knowledge and Data Engineering, IEEE Transactions on",1,17
149,1,150,0,0,Stock risk mining by news,0,Qi Pan and Hong Cheng and Di Wu and Jeffrey Xu Yu and Yiping Ke,2010,inproceedings,0,0,0,http://portal.acm.org/citation.cfm?id=1862265&CFID=17470975&CFTOKEN=71845406,179--188,"Database Technologies 2010, Twenty-First Australasian Database Conference {(ADC} 2010), Brisbane, Australia, 18-22 January, 2010, Proceedings",DBLP:conf/adc/2010,1908,Stock risk mining by news,Proceedings of the Twenty-First Australasian Conference on Database Technologies-Volume 104,"Pan, Qi and Cheng, Hong and Wu, Di and Yu, Jeffrey Xu and Ke, Yiping",179--188,2010,"Australian Computer Society, Inc.",inproceedings,0,0,0,
150,0,2340,0,0,Learning the Kernel Matrix with Semidefinite Programming,0,Gert R. G. Lanckriet and Nello Cristianini and Peter L. Bartlett and Laurent El Ghaoui and Michael I. Jordan,2004,article,Journal of Machine Learning Research,0,5,http://www.jmlr.org/papers/v5/lanckriet04a.html,27--72,0,0,2197,Divide-and-conquer matrix factorization,Advances in Neural Information Processing Systems,"Mackey, Lester W and Jordan, Michael I and Talwalkar, Ameet",1134--1142,2011,0,inproceedings,0,0,0,
151,0,683,0,0,Graph Indexing: Tree + Delta {\textgreater}= Graph,0,Peixiang Zhao and Jeffrey Xu Yu and Philip S. Yu,2007,inproceedings,0,0,0,http://www.vldb.org/conf/2007/papers/research/p938-zhao.pdf,938--949,"Proceedings of the 33rd International Conference on Very Large Data Bases, University of Vienna, Austria, September 23-27, 2007",DBLP:conf/vldb/2007,1606,Similarity match over high speed time-series streams,"Data Engineering, 2007. ICDE 2007. IEEE 23rd International Conference on","Lian, Xiang and Chen, Lei and Yu, Jeffrey Xu and Wang, Guoren and Yu, Ge",1086--1095,2007,IEEE,inproceedings,0,0,0,
152,1,262,0,0,Supporting Range Queries in a Wireless Environment with Nonuniform Broadcast,0,Kian{-}Lee Tan and Jeffrey Xu Yu and Pin{-}Kwang Eng,1999,article,Data Knowl. Eng.,2,29,http://dx.doi.org/10.1016/S0169-023X(98)00038-X,201--221,0,0,1725,Supporting range queries in a wireless environment with nonuniform broadcast,0,"Tan, Kian-Lee and Yu, Jeffrey Xu and Eng, Pin-Kwang",201--221,1999,0,article,North-Holland,Data \& knowledge engineering,2,29
153,1,2173,0,0,Combining Visualization and Statistical Analysis to Improve Operator Confidence and Efficiency for Failure Detection and Localization,0,Peter Bod{\'{\i}}k and Greg Friedman and Lukas Biewald and Helen Levine and George Candea and Kayur Patel and Gilman Tolle and Jonathan Hui and Armando Fox and Michael I. Jordan and David A. Patterson,2005,inproceedings,0,0,0,http://doi.ieeecomputersociety.org/10.1109/ICAC.2005.18,89--100,"Second International Conference on Autonomic Computing {(ICAC} 2005), 13-16 June 2005, Seattle, WA, {USA}",DBLP:conf/icac/2005,2265,Combining visualization and statistical analysis to improve operator confidence and efficiency for failure detection and localization,"Autonomic Computing, 2005. ICAC 2005. Proceedings. Second International Conference on","Bodik, Peter and Friedman, Greg and Biewald, Lukas and Levine, Helen and Candea, George and Patel, Kayur and Tolle, Gilman and Hui, Jon and Fox, Armando and Jordan, Michael and others",89--100,2005,IEEE,inproceedings,0,0,0,
154,0,167,0,0,How to Build Templates for {RDF} Question/Answering: An Uncertain Graph Similarity Join Approach,0,Weiguo Zheng and Lei Zou and Xiang Lian and Jeffrey Xu Yu and Shaoxu Song and Dongyan Zhao,2015,inproceedings,0,0,0,http://doi.acm.org/10.1145/2723372.2747648,1809--1824,"Proceedings of the 2015 {ACM} {SIGMOD} International Conference on Management of Data, Melbourne, Victoria, Australia, May 31 - June 4, 2015",DBLP:conf/sigmod/2015,1842,Full-scale collapse test and numerical simulation of deepwater pipeline,0,"Yu, JX and Bian, XH and Yu, Y and Wang, YG",154--159,2012,0,article,0,Journal of Tianjin University,2,45
155,0,1561,0,0,Integrating heterogeneous data warehouses using {XML} technologies,0,Frank S. C. Tseng and Chia{-}Wei Chen,2005,article,J. Information Science,3,31,http://dx.doi.org/10.1177/0165551505052467,209--229,0,0,2855,One-class learning and concept summarization for data streams,0,"Zhu, Xingquan and Ding, Wei and Philip, S Yu and Zhang, Chengqi",523--553,2011,0,article,Springer-Verlag,Knowledge and Information Systems,3,28
156,0,644,0,0,Patterns Discovery Based on Time-Series Decomposition,0,Jeffrey Xu Yu and Michael K. Ng and Joshua Zhexue Huang,2001,inproceedings,0,0,0,http://dx.doi.org/10.1007/3-540-45357-1_36,336--347,"Knowledge Discovery and Data Mining - {PAKDD} 2001, 5th Pacific-Asia Conference, Hong Kong, China, April 16-18, 2001, Proceedings",DBLP:conf/pakdd/2001,2259,Perceptual distortion contributes to the curvature of human reaching movements,0,"Wolpert, Daniel M and Ghahramani, Zoubin and Jordan, Michael I",153--156,1994,0,article,Springer-Verlag,Experimental brain research,1,98
157,0,225,0,0,Sliding-window top-k queries on uncertain streams,0,Cheqing Jin and Ke Yi and Lei Chen and Jeffrey Xu Yu and Xuemin Lin,2008,article,PVLDB,1,1,http://www.vldb.org/pvldb/1/1453892.pdf,301--312,0,0,1770,Sliding-window top-k queries on uncertain streams,0,"Jin, Cheqing and Yi, Ke and Chen, Lei and Yu, Jeffrey Xu and Lin, Xuemin",411--435,2010,0,article,Springer-Verlag,The VLDB Journal,3,19
158,0,2101,0,0,Computing Upper and Lower Bounds on Likelihoods in Intractable Networks,0,Tommi S. Jaakkola and Michael I. Jordan,2013,article,CoRR,0,abs/1302.3586,http://arxiv.org/abs/1302.3586,0,0,0,2212,Computing upper and lower bounds on likelihoods in intractable networks,Proceedings of the Twelfth international conference on Uncertainty in artificial intelligence,"Jaakkola, Tommi S and Jordan, Michael I",340--348,1996,Morgan Kaufmann Publishers Inc.,inproceedings,0,0,0,
159,1,791,0,0,Bayesian Haplotype Inference via the Dirichlet Process,0,Eric P. Xing and Michael I. Jordan and Roded Sharan,2007,article,Journal of Computational Biology,3,14,http://dx.doi.org/10.1089/cmb.2006.0102,267--284,0,0,2187,Bayesian haplotype inference via the Dirichlet process,0,"Xing, Eric P and Jordan, Michael I and Sharan, Roded",267--284,2007,0,article,"Mary Ann Liebert, Inc. 2 Madison Avenue Larchmont, NY 10538 USA",Journal of Computational Biology,3,14
160,0,1444,0,0,Towards a Dynamic Data Driven Application System for Wildfire Simulation,0,Jan Mandel and Lynn S. Bennethum and Mingshi Chen and Janice L. Coen and Craig C. Douglas and Leopoldo P. Franca and Craig J. Johns and Minjeong Kim and Andrew V. Knyazev and Robert Kremens and Vaibhav Kulkarni and Guan Qin and Anthony Vodacek and Jianjia Wu and Wei Zhao and Adam Zornes,2005,inproceedings,0,0,0,http://dx.doi.org/10.1007/11428848_82,632--639,"Computational Science - {ICCS} 2005, 5th International Conference, Atlanta, GA, USA, May 22-25, 2005, Proceedings, Part {II}",DBLP:conf/iccS/2005-2,2607,Loadstar: A Load Shedding Scheme for Classifying Data Streams.,SDM,"Chi, Yun and Philip, S Yu and Wang, Haixun and Muntz, Richard R",346--357,2005,0,inproceedings,0,0,0,
161,0,55,0,0,Predicting the Start of Protein \emph{alpha}-Helices Using Machine Learning Algorithms,0,Rui Camacho and Rita Ferreira and Natacha Rosa and V{\^{a}}nia Guimar{\~{a}}es and Nuno A. Fonseca and V{\'{\i}}tor Santos Costa and Miguel de Sousa and Alexandre Magalh{\~{a}}es,2010,inproceedings,0,0,0,http://dx.doi.org/10.1007/978-3-642-13214-8_5,33--41,"Advances in Bioinformatics - 4th International Workshop on Practical Applications of Computational Biology and Bioinformatics 2010 {(IWPACBB} 2010), Guimar{\~{a}}es, Portugal, 16-18 June 2010",DBLP:conf/isami/2010iwpacbb,2924,Systems and methods for predictive failure management,0,"Chang, Shu-Ping and Gu, Xiaohui and Papadimitriou, Spyridon and Yu, Philip Shi-lung",0,2010,0,misc,0,0,0,
162,0,1878,0,0,On Highly Secure and Available Data Storage Systems,0,Sung Jin Choi and Hee Yong Youn and Hyung Soo Lee,2004,inproceedings,0,0,0,http://dx.doi.org/10.1007/978-3-540-24687-9_16,121--129,"Computational Science - {ICCS} 2004, 4th International Conference, Krak{\'{o}}w, Poland, June 6-9, 2004, Proceedings, Part {II}",DBLP:conf/iccS/2004-2,1175,Neighbourhood components analysis,Advances in neural information processing systems,"Goldberger, Jacob and Hinton, Geoffrey E and Roweis, Sam T and Salakhutdinov, Ruslan",513--520,2004,0,inproceedings,0,0,0,
163,0,101,0,0,Supporting Keyword Queries on Structured Databases with Limited Search Interfaces,0,Nurcan Yuruk and Xiaowei Xu and Chen Li and Jeffrey Xu Yu,2008,inproceedings,0,0,0,http://dx.doi.org/10.1007/978-3-540-78568-2_32,432--439,"Database Systems for Advanced Applications, 13th International Conference, {DASFAA} 2008, New Delhi, India, March 19-21, 2008. Proceedings",DBLP:conf/dasfaa/2008,2397,Content based method for product-peer filtering,0,"Aggarwal, Charu C and Philip, S Yu",0,2002,0,misc,0,0,0,
164,0,969,0,0,A Sparse Learning Machine for High-Dimensional Data with Application to Microarray Gene Analysis,0,Qiang Cheng,2010,article,{IEEE/ACM} Trans. Comput. Biology Bioinform.,4,7,http://dx.doi.org/10.1109/TCBB.2009.8,636--646,0,0,860,Biometrics-based identifiers for digital identity management,Proceedings of the 9th Symposium on Identity and Trust on the Internet,"Bhargav-Spantzel, Abhilasha and Squicciarini, Anna and Bertino, Elisa and Kong, Xiangwei and Zhang, Weike",84--96,2010,ACM,inproceedings,0,0,0,
165,0,2217,0,0,Kernel-Based Data Fusion and Its Application to Protein Function Prediction in Yeast,0,Gert R. G. Lanckriet and Minghua Deng and Nello Cristianini and Michael I. Jordan and William Stafford Noble,2004,inproceedings,0,0,0,http://psb.stanford.edu/psb-online/proceedings/psb04/lanckriet.pdf,300--311,"Biocomputing 2004, Proceedings of the Pacific Symposium, Hawaii, USA, 6-10 January 2004",DBLP:conf/psb/2004,2313,Matrix concentration inequalities via the method of exchangeable pairs,0,"Mackey, Lester and Jordan, Michael I and Chen, Richard Y and Farrell, Brendan and Tropp, Joel A and others",906--945,2014,0,article,Institute of Mathematical Statistics,The Annals of Probability,3,42
166,0,93,0,0,Online Learning for Interactive Statistical Machine Translation,0,Daniel Ortiz{-}Mart{\'{\i}}nez and Ismael Garc{\'{\i}}a{-}Varea and Francisco Casacuberta,2010,inproceedings,0,0,0,http://www.aclweb.org/anthology/N10-1079,546--554,"Human Language Technologies: Conference of the North American Chapter of the Association of Computational Linguistics, Proceedings, June 2-4, 2010, Los Angeles, California, {USA}",DBLP:conf/naacl/2010,2202,Computational models of sensorimotor integration,0,"Ghahramani, Zoubin and Wolptrt, Daniel M and Jordan, Michael I",117--147,1997,0,article,North-Holland,Advances in Psychology,0,119
167,1,2186,0,0,Thin Junction Trees,0,Francis R. Bach and Michael I. Jordan,2001,inproceedings,0,0,0,http://papers.nips.cc/paper/2069-thin-junction-trees,569--576,"Advances in Neural Information Processing Systems 14 [Neural Information Processing Systems: Natural and Synthetic, {NIPS} 2001, December 3-8, 2001, Vancouver, British Columbia, Canada]",DBLP:conf/nips/2001,2206,Thin junction trees,Advances in Neural Information Processing Systems,"Bach, Francis R and Jordan, Michael I",569--576,2001,0,inproceedings,0,0,0,
168,1,288,0,0,Mining Frequent Items in Spatio-temporal Databases,0,Cheqing Jin and Fang Xiong and Joshua Zhexue Huang and Jeffrey Xu Yu and Aoying Zhou,2004,inproceedings,0,0,0,http://dx.doi.org/10.1007/978-3-540-27772-9_55,549--558,"Advances in Web-Age Information Management: 5th International Conference, {WAIM} 2004, Dalian, China, July 15-17, 2004",DBLP:conf/waim/2004,1941,Mining frequent items in spatio-temporal databases,Advances in Web-Age Information Management,"Jin, Cheqing and Xiong, Fang and Huang, Joshua Zhexue and Yu, Jeffrey Xu and Zhou, Aoying",549--558,2004,0,incollection,Springer Berlin Heidelberg,0,0,
169,0,1993,0,0,The Primary Language of ancient battles,0,Boris Stilman and Vladimir Yakhnis and Oleg Umanskiy,2011,article,Int. J. Machine Learning {\&} Cybernetics,3,2,http://dx.doi.org/10.1007/s13042-011-0029-9,157--176,0,0,453,Indexing techniques for advanced database systems,0,"Bertino, Elisa and Ooi, Beng Chin and Sacks-Davis, Ron and Tan, Kian-Lee and Zobel, Justin and Shidlovsky, Boris and Andronico, Daniele",0,2012,0,book,Springer Science \& Business Media,0,0,8
170,0,2627,0,0,Problems in the computerization of chemical information: capture of tabular and graphical data,0,J. H. Westbrook,1993,article,Journal of Chemical Information and Computer Sciences,1,33,http://dx.doi.org/10.1021/ci00011a002,6--17,0,0,1434,Generative multiple-instance learning models for quantitative electromyography,0,"Adel, Tameem and Smith, Benn and Urner, Ruth and Stashuk, Daniel and Lizotte, Daniel J",0,2013,0,article,0,arXiv preprint arXiv:1309.6811,0,
171,0,2391,0,0,"{ADAM:} a graphical, object-oriented database-design tool and code generator",0,Heidi J. C. Ellis and Steven A. Demurjian,1991,inproceedings,0,0,0,http://doi.acm.org/10.1145/327164.327337,496--505,"Proceedings of the 19th annual conference on Computer Science, {CSC} '91, San Antonio, Texas, USA, March 4-7, 1991",DBLP:conf/acm/1991,2979,The interaction of parallel and sequential workloads on a network of workstations,0,"Arpaci, Remzi H and Dusseau, Andrea C and Vahdat, Amin M and Liu, Lok T and Anderson, Thomas E and Patterson, David A",267--278,1995,0,article,ACM,ACM SIGMETRICS Performance Evaluation Review,1,23
172,1,665,0,0,Parameter Free Bursty Events Detection in Text Streams,0,Gabriel Pui Cheong Fung and Jeffrey Xu Yu and Philip S. Yu and Hongjun Lu,2005,inproceedings,0,0,0,http://www.vldb2005.org/program/paper/tue/p181-fung.pdf,181--192,"Proceedings of the 31st International Conference on Very Large Data Bases, Trondheim, Norway, August 30 - September 2, 2005",DBLP:conf/vldb/2005,1611,Parameter free bursty events detection in text streams,Proceedings of the 31st international conference on Very large data bases,"Fung, Gabriel Pui Cheong and Yu, Jeffrey Xu and Yu, Philip S and Lu, Hongjun",181--192,2005,VLDB Endowment,inproceedings,0,0,0,
173,0,2665,0,0,Using Machine Learning to Support Resource Quality Assessment: An Adaptive Attribute-Based Approach for Health Information Portals,0,Jue Xie and Frada Burstein,2011,inproceedings,0,0,0,http://dx.doi.org/10.1007/978-3-642-20244-5_50,526--537,"Database Systems for Adanced Applications - 16th International Conference, {DASFAA} 2011, International Workshops: GDB, SIM3, FlashDB, SNSMW, DaMEN, DQIS, Hong Kong, China, April 22-25, 2011. Proceedings",DBLP:conf/dasfaa/2011w,808,xfACL: An extensible functional language for access control,Proceedings of the 16th ACM symposium on Access control models and technologies,"Ni, Qun and Bertino, Elisa",61--72,2011,ACM,inproceedings,0,0,0,
174,0,2428,0,0,Coupling visualization and data analysis for knowledge discovery from multi-dimensional scientific data,0,Oliver R{\{u}}bel and Sean Ahern and E. Wes Bethel and Mark D. Biggin and Hank Childs and Estelle Cormier{-}Michel and Angela H. DePace and Michael B. Eisen and Charless C. Fowlkes and Cameron G. R. Geddes and Hans Hagen and Bernd Hamann and Min{-}Yu Huang and Soile V. E. Ker{\{a}}nen and David W. Knowles and Cris L. Luengo Hendriks and Jitendra Malik and Jeremy S. Meredith and Peter Messmer and Prabhat,2010,inproceedings,0,1,0,http://dx.doi.org/10.1016/j.procs.2010.04.197,1757--1764,"Proceedings of the International Conference on Computational Science, {ICCS} 2010, University of Amsterdam, The Netherlands, May 31 - June 2, 2010",DBLP:conf/iccS/2010,1183,Deterministic Boltzmann learning performs steepest descent in weight-space,0,"Hinton, Geoffrey E",143--150,1989,0,article,0,Neural computation,1,1
175,1,237,0,0,Hierarchical Indexing Approach to Support XPath Queries,0,Nan Tang and Jeffrey Xu Yu and M. Tamer {\{O}}zsu and Kam{-}Fai Wong,2008,inproceedings,0,0,0,http://dx.doi.org/10.1109/ICDE.2008.4497606,1510--1512,"Proceedings of the 24th International Conference on Data Engineering, {ICDE} 2008, April 7-12, 2008, Canc{\'{u}}n, M{\'{e}}xico",DBLP:conf/icde/2008,1973,Hierarchical indexing approach to support XPath queries,"Data Engineering, 2008. ICDE 2008. IEEE 24th International Conference on","Tang, Nan and Yu, Jeffrey Xu and {\O}zsu, M Tamer and Wong, Kam-Fai",1510--1512,2008,IEEE,inproceedings,0,0,0,
176,0,282,0,0,Adaptive relaxation for querying heterogeneous {XML} data sources,0,Chengfei Liu and Jianxin Li and Jeffrey Xu Yu and Rui Zhou,2010,article,Inf. Syst.,6,35,http://dx.doi.org/10.1016/j.is.2010.02.002,688--707,0,0,1770,Sliding-window top-k queries on uncertain streams,0,"Jin, Cheqing and Yi, Ke and Chen, Lei and Yu, Jeffrey Xu and Lin, Xuemin",411--435,2010,0,article,Springer-Verlag,The VLDB Journal,3,19
177,0,2241,0,0,Online System Problem Detection by Mining Patterns of Console Logs,0,Wei Xu and Ling Huang and Armando Fox and David A. Patterson and Michael I. Jordan,2009,inproceedings,0,0,0,http://dx.doi.org/10.1109/ICDM.2009.19,588--597,"{ICDM} 2009, The Ninth {IEEE} International Conference on Data Mining, Miami, Florida, USA, 6-9 December 2009",DBLP:conf/icdm/2009,527,D-algebra for composing access control policy decisions,"Proceedings of the 4th International Symposium on Information, Computer, and Communications Security","Ni, Qun and Bertino, Elisa and Lobo, Jorge",298--309,2009,ACM,inproceedings,0,0,0,
178,0,207,0,0,{ELCA} evaluation for keyword search on probabilistic {XML} data,0,Rui Zhou and Chengfei Liu and Jianxin Li and Jeffrey Xu Yu,2013,article,World Wide Web,2,16,http://dx.doi.org/10.1007/s11280-012-0166-4,171--193,0,0,2806,Dynamic transaction routing in distributed database systems,0,"Yu, Philip S and Balsamo, Simonetta and Lee, Yann-Hang",1307--1318,1988,0,article,IEEE,"Software Engineering, IEEE Transactions on",9,14
179,0,727,0,0,Classifying Text Streams in the Presence of Concept Drifts,0,Gabriel Pui Cheong Fung and Jeffrey Xu Yu and Hongjun Lu,2004,inproceedings,0,0,0,http://dx.doi.org/10.1007/978-3-540-24775-3_45,373--383,"Advances in Knowledge Discovery and Data Mining, 8th Pacific-Asia Conference, {PAKDD} 2004, Sydney, Australia, May 26-28, 2004, Proceedings",DBLP:conf/pakdd/2004,1091,Supporting Multi-Dimensional Trustworthiness for Grid Workflows.,DELOS Workshop: Digital Library Architectures,"Bertino, Elisa and Crispo, Bruno and Mazzoleni, Pietro",195--204,2004,0,inproceedings,0,0,0,
180,0,663,0,0,Mining most frequently changing component in evolving graphs,0,Yajun Yang and Jeffrey Xu Yu and Hong Gao and Jian Pei and Jianzhong Li,2014,article,World Wide Web,3,17,http://dx.doi.org/10.1007/s11280-013-0204-x,351--376,0,0,2054,Finite Element Analysis and Experimental of Milling Force for Aeronautical Thin-Walled Workpiece,Advanced Materials Research,"Yu, Jin and Shi, Yu Xiang and Yang, Gui Wu",685--689,2011,0,inproceedings,0,0,0,328
181,0,2067,0,0,Statistical modeling of biomedical corpora: mining the Caenorhabditis Genetic Center Bibliography for genes related to life span,0,David M. Blei and K. Franks and Michael I. Jordan and I. Saira Mian,2006,article,{BMC} Bioinformatics,0,7,http://dx.doi.org/10.1186/1471-2105-7-250,250,0,0,2760,Meta path-based collective classification in heterogeneous information networks,Proceedings of the 21st ACM international conference on Information and knowledge management,"Kong, Xiangnan and Yu, Philip S and Ding, Ying and Wild, David J",1567--1571,2012,ACM,inproceedings,0,0,0,
182,0,2277,0,0,Graphical Models: Foundations of Neural Computation,0,Michael I. Jordan and Terrence J. Sejnowski,2002,article,Pattern Anal. Appl.,4,5,http://dx.doi.org/10.1007/s100440200036,401--402,0,0,2273,Graphical models: Foundations of neural computation,0,"Jordan, Michael Irwin",0,2001,0,book,MIT press,0,0,
183,1,253,0,0,Clustering large attributed information networks: an efficient incremental computing approach,0,Hong Cheng and Yang Zhou and Xin Huang and Jeffrey Xu Yu,2012,article,Data Min. Knowl. Discov.,3,25,http://dx.doi.org/10.1007/s10618-012-0263-0,450--477,0,0,1801,Clustering large attributed information networks: an efficient incremental computing approach,0,"Cheng, Hong and Zhou, Yang and Huang, Xin and Yu, Jeffrey Xu",450--477,2012,0,article,Springer US,Data Mining and Knowledge Discovery,3,25
184,1,220,0,0,Approximate Closest Community Search in Networks,0,Xin Huang and Laks V. S. Lakshmanan and Jeffrey Xu Yu and Hong Cheng,2015,article,CoRR,0,abs/1505.05956,http://arxiv.org/abs/1505.05956,0,0,0,2071,Approximate Closest Community Search in Networks,0,"Huang, Xin and Lakshmanan, Laks VS and Yu, Jeffrey Xu and Cheng, Hong",0,2015,0,article,0,arXiv preprint arXiv:1505.05956,0,
185,0,80,0,0,Classification of abnormalities in digitized mammograms using Extreme Learning Machine,0,Gopalan Vani and Ramaswamy Savitha and Narasimhan Sundararajan,2010,inproceedings,0,0,0,http://dx.doi.org/10.1109/ICARCV.2010.5707794,2114--2117,"11th International Conference on Control, Automation, Robotics and Vision, {ICARCV} 2010, Singapore, 7-10 December 2010, Proceedings",DBLP:conf/icarcv/2010,1280,Unsupervised learning of image transformations,"Computer Vision and Pattern Recognition, 2007. CVPR'07. IEEE Conference on","Memisevic, Roland and Hinton, Geoffrey",1--8,2007,IEEE,inproceedings,0,0,0,
186,0,1036,0,0,"Optimal Policy for Single-Machine Scheduling with Deterioration Effects, Learning Effects, Setup Times, and Availability Constraints",0,Sheng Yu and Yinfeng Xu and Ming Liu and Feifeng Zheng,2011,inproceedings,0,0,0,http://dx.doi.org/10.1007/978-3-642-22616-8_6,64--73,"Combinatorial Optimization and Applications - 5th International Conference, {COCOA} 2011, Zhangjiajie, China, August 4-6, 2011. Proceedings",DBLP:conf/cocoa/2011,2665,The Effect of Skewed Data Access on Buffer Hits and Data Contention an a Data Sharing Environment.,VLDB,"Dan, Asit and Dias, Daniel M and Philip, S Yu",419--431,1990,0,inproceedings,0,0,0,
